source_title,source_url,text
Surveillance,https://en.wikipedia.org/wiki/Surveillance,"With the development of digital technology, individuals have become increasingly perceptible to one another, as surveillance becomes virtual. Online surveillance is the utilization of the internet to observe one's activity. [ 150 ] Corporations, citizens, and governments participate in tracking others' behaviours for motivations that arise out of business relations, to curiosity, to legality. In her book Superconnected , Mary Chayko differentiates between two types of surveillance: vertical and horizontal. [ 150 ] Vertical surveillance occurs when there is a dominant force, such as the government that is attempting to control or regulate the actions of a given society. Such powerful authorities often justify their incursions as a means to protect society from threats of violence or terrorism. Some individuals question when this becomes an infringement on civil rights. [ 150 ]"
Surveillance,https://en.wikipedia.org/wiki/Surveillance,"Horizontal diverges from vertical surveillance as the tracking shifts from an authoritative source to an everyday figure, such as a friend, coworker, or stranger that is interested in one's mundane activities. [ 150 ] Individuals leave traces of information when they are online that reveal their interests and desires of which others observe. While this can allow people to become interconnected and develop social connections online, it can also increase potential risk to harm, such as cyberbullying or censoring/stalking by strangers, reducing privacy. [ 150 ]"
Surveillance,https://en.wikipedia.org/wiki/Surveillance,"In addition, Simone Browne argues that surveillance wields an immense racializing quality such that it operates as ""racializing surveillance."" Browne uses racializing surveillance to refer to moments when enactments of surveillance are used to reify boundaries, borders, and bodies along racial lines and where the outcome is discriminatory treatment of those who are negatively racialized by such surveillance. Browne argues racializing surveillance pertains to policing what is ""in or out of place."" [ 151 ] [ 152 ]"
Surveillance,https://en.wikipedia.org/wiki/Surveillance,"Numerous civil rights groups and privacy groups oppose surveillance as a violation of people's right to privacy. Such groups include: Electronic Privacy Information Center , Electronic Frontier Foundation , American Civil Liberties Union and Privacy International ."
Surveillance,https://en.wikipedia.org/wiki/Surveillance,"There have been several lawsuits such as Hepting v. AT&T and EPIC v. Department of Justice by groups or individuals, opposing certain surveillance activities."
Surveillance,https://en.wikipedia.org/wiki/Surveillance,"Legislative proceedings such as those that took place during the Church Committee , which investigated domestic intelligence programs such as COINTELPRO , have also weighed the pros and cons of surveillance."
Surveillance,https://en.wikipedia.org/wiki/Surveillance,"People vs. Diaz (2011) was a court case in the realm of cell phone privacy, even though the decision was later overturned. In this case, Gregory Diaz was arrested during a sting operation for attempting to sell ecstasy. During his arrest, police searched Diaz's phone and found more incriminating evidence including SMS text messages and photographs depicting illicit activities. During his trial, Diaz attempted to have the information from his cell phone removed from evidence, but the courts deemed it as lawful and Diaz's appeal was denied on the California State Court level and, later, the Supreme Court level. Just three short years after, this decision was overturned in the case Riley vs. California (2014). [ 153 ]"
Surveillance,https://en.wikipedia.org/wiki/Surveillance,"Riley vs. California (2014) was a U.S. Supreme Court case in which a man was arrested for his involvement in a drive-by shooting. A few days after the shooting the police made an arrest of the suspect (Riley), and, during the arrest, the police searched him. However, this search was not only of Riley's person, but also the police opened and searched his cell phone, finding pictures of other weapons, drugs, and of Riley showing gang signs. In court, the question arose whether searching the phone was lawful or if the search was protected by the 4th amendment of the American Constitution . The decision held that the search of Riley's cell phone during the arrest was illegal, and that it was protected by the 4th Amendment. [ 154 ]"
Surveillance,https://en.wikipedia.org/wiki/Surveillance,"Countersurveillance is the practice of avoiding surveillance or making surveillance difficult. Developments in the late twentieth century have caused counter surveillance to dramatically grow in both scope and complexity, such as the Internet, increasing prevalence of electronic security systems , high-altitude (and possibly armed) UAVs , and large corporate and government computer databases. [ 155 ] Other examples include encrypted messenger apps such as Signal [ 156 ] [ 157 ] and privacy cryptocurrencies such as Monero [ 158 ] [ 159 ] and ZCash. [ 160 ]"
Surveillance,https://en.wikipedia.org/wiki/Surveillance,"Inverse surveillance is the practice of the reversal of surveillance on other individuals or groups (e.g., citizens photographing police). Well-known examples include George Holliday 's recording of the Rodney King beating and the organization Copwatch , which attempts to monitor police officers to prevent police brutality . Counter-surveillance can be also used in applications to prevent corporate spying, or to track other criminals by certain criminal entities. It can also be used to deter stalking methods used by various entities and organizations."
Surveillance,https://en.wikipedia.org/wiki/Surveillance,"Sousveillance is inverse surveillance, involving the recording by private individuals, rather than government or corporate entities. [ 161 ]"
Internet of things,https://en.wikipedia.org/wiki/Internet_of_things,"Internet of things ( IoT ) describes physical objects that are embedded with sensors , processing ability, software , and other technologies that connect and exchange data with other devices and systems over the Internet or other communication networks. [ 1 ] [ 2 ] [ 3 ] [ 4 ] [ 5 ] The field of IoT encompasses electronics , communication , and computer science engineering. ""Internet of things"" has been considered a misnomer because most devices do not need to be connected to the public Internet; they only need to be connected to a network [ 6 ] and be individually addressable. [ 7 ] [ 8 ]"
Internet of things,https://en.wikipedia.org/wiki/Internet_of_things,"The field has evolved due to the convergence of multiple technologies, including ubiquitous computing , sensors , embedded systems , and machine learning . [ 9 ] Traditional fields of embedded systems, wireless sensor networks , control systems, and automation independently and collectively enable the Internet of things."
Internet of things,https://en.wikipedia.org/wiki/Internet_of_things,"While in the consumer market, IoT technology is most commonly as smart home products—including devices and appliances like thermostats and smart speakers —the technology's largest applications are in the business and industrial sectors. Commercial asset tracking and fleet management represent the largest single application of IoT, accounting for 22% of the total market, driven by the need to monitor mobile assets like vehicles and shipping containers. [ 10 ] The largest asset tracking sub-segments in transport & logistics are trailer and intermodal container tracking, reaching 5.8 million and 5.3 million active devices globally at the end of 2024 respectively. [ 11 ] Other major applications include industrial monitoring, smart metering in utilities, and connected healthcare. [ 12 ]"
Internet of things,https://en.wikipedia.org/wiki/Internet_of_things,"However, several concerns exist regarding the risks associated with the growth and diffusion of IoT technologies and products, particularly in the areas of privacy and security . Consequently, several industries, technology companies, and governments (i.e. their branches, ministries, bureaus, departments, etc.) of many countries have taken multiple steps and implemented a variety of precautionary measures to address these concerns adequately and minimize safety risks, including the development and implementation of international and local standards, guidelines, and regulatory frameworks. [ 13 ] Due to their interconnected nature, IoT devices are vulnerable to security breaches and privacy concerns. At the same time, the way these devices communicate wirelessly creates regulatory ambiguities, complicating jurisdictional boundaries of the data transfer. [ 14 ]"
Internet of things,https://en.wikipedia.org/wiki/Internet_of_things,"Around 1972, for its remote site use, the Stanford Artificial Intelligence Laboratory developed a computer-controlled vending machine, adapted from a machine rented from Canteen Vending , which sold for cash or, through a computer terminal ( Teletype Model 33 KSR ), [ 15 ] on credit. [ 16 ] Amongst its products were beer, yogurt, and milk. [ 16 ] [ 15 ] It was named Prancing Pony , after the name of the room, which was named after an inn in J. R. R. Tolkien 's epic fantasy novel The Lord of the Rings . [ 16 ] [ 17 ] A successor version still operates in the Computer Science Department at Stanford , with updated hardware and software. [ 16 ]"
Internet of things,https://en.wikipedia.org/wiki/Internet_of_things,"In 1982, [ 18 ] an early concept of a network connected smart device was constructed as an Internet interface for sensors installed in the Carnegie Mellon University Computer Science Department ' s departmental Coca-Cola vending machine , supplied by graduate student volunteers, provided a temperature model and an inventory status, [ 19 ] [ 20 ] inspired by the computer controlled vending machine in the Prancing Pony room at Stanford Artificial Intelligence Laboratory . [ 21 ] While it was initially accessible only on the CMU campus, it gained prominence as the first ARPANET -connected appliance. [ 22 ] [ 23 ]"
Internet of things,https://en.wikipedia.org/wiki/Internet_of_things,"Mark Weiser 's 1991 paper on ubiquitous computing , ""The Computer of the 21st Century"", as well as academic venues such as UbiComp and PerCom, produced the contemporary vision of the IoT. [ 24 ] [ 25 ] In 1994, Reza Raji described the concept in IEEE Spectrum as ""[moving] small packets of data to a large set of nodes, so as to integrate and automate everything from home appliances to entire factories."" [ 26 ] Between 1993 and 1997, several companies proposed solutions, such as Microsoft 's at Work or Novell 's NEST . The field gained momentum when Bill Joy envisioned device-to-device communication as part of his ""Six Webs"" framework, which was presented at the World Economic Forum in Davos in 1999. [ 27 ]"
Internet of things,https://en.wikipedia.org/wiki/Internet_of_things,"The concept of the ""Internet of things"" and the term itself first appeared in a speech by Peter T. Lewis to the Congressional Black Caucus Foundation 15th Annual Legislative Weekend in Washington, D.C. , published in September 1985. According to Lewis, ""The Internet of Things, or IoT, is the integration of people, processes, and technology with connectable devices and sensors to enable remote monitoring, status, manipulation, and evaluation of trends of such devices."" [ 28 ]"
Internet of things,https://en.wikipedia.org/wiki/Internet_of_things,"The term ""Internet of things"" was coined independently by Kevin Ashton of Procter & Gamble , later of Massachusetts Institute of Technology 's Auto-ID Center , in 1999, [ 29 ] despite preferring the phrase ""Internet for things."" [ 30 ] At that point, he considered radio-frequency identification (RFID) an essential component of the Internet of things, [ 31 ] as it would effectively enable computers to manage all individual things. [ 32 ] [ 33 ] [ 34 ] The primary defining characteristic of the Internet of things has been considered its ability to embed short-range mobile transceivers in various gadgets and daily necessities, enabling new forms of communication between people and things, as well as between things themselves. [ 35 ]"
Internet of things,https://en.wikipedia.org/wiki/Internet_of_things,"In 2004, Cornelius ""Pete"" Peterson, CEO of NetSilicon, predicted that ""The next era of information technology will be dominated by [IoT] devices, and networked devices will ultimately gain in popularity and significance to the extent that they will far exceed the number of networked computers and workstations."" Peterson believed that medical devices and industrial controls would become dominant applications of the technology. [ 36 ]"
Internet of things,https://en.wikipedia.org/wiki/Internet_of_things,"Defining the Internet of things as ""simply the point in time when more 'things or objects' were connected to the Internet than people"", Cisco Systems estimated that the IoT was ""born"" between 2008 and 2009, with the things/people ratio growing from 0.08 in 2003 to 1.84 in 2010. [ 37 ]"
Internet of things,https://en.wikipedia.org/wiki/Internet_of_things,"The extensive set of applications for IoT devices [ 38 ] is often divided into consumer, commercial, industrial, and infrastructure spaces. [ 39 ] [ 40 ]"
Internet of things,https://en.wikipedia.org/wiki/Internet_of_things,"A growing portion of IoT devices is created for consumer use, including connected vehicles, home automation , wearable technology , connected health, and appliances with remote monitoring capabilities. [ 41 ]"
Internet of things,https://en.wikipedia.org/wiki/Internet_of_things,"IoT devices are part of the broader concept of home automation , which generally includes lighting, heating and air conditioning, media and security systems, and camera systems. [ 42 ] [ 43 ] Moreover, long-term benefits could include energy savings by automatically ensuring lights and electronics are turned off or by making the residents in the home aware of usage. [ 44 ]"
Internet of things,https://en.wikipedia.org/wiki/Internet_of_things,"A smart home, also known as an automated home, could be based on a platform or hubs that control smart devices and appliances. [ 45 ] For instance, using Apple 's HomeKit , manufacturers can have their home products and accessories controlled by an application in iOS devices such as the iPhone and the Apple Watch . [ 46 ] [ 47 ] This could be a dedicated app or iOS native applications such as Siri . [ 48 ] This can be demonstrated in the case of Lenovo's Smart Home Essentials, which is a line of smart home devices that are controlled through Apple's Home app or Siri without the need for a Wi-Fi bridge. [ 48 ] There are also dedicated smart home hubs that are offered as standalone platforms to connect different smart home products. These include the Amazon Echo , Google Home , Apple's HomePod , and Samsung 's SmartThings Hub . [ 49 ] In addition to the commercial systems, there are many non-proprietary, open source ecosystems, including Home Assistant, OpenHAB, and Domoticz. [ 50 ]"
Internet of things,https://en.wikipedia.org/wiki/Internet_of_things,"One key application of a smart home is to assist the elderly and individuals with disabilities . These home systems use assistive technology to accommodate an owner's specific disabilities. [ 51 ] Voice control can assist users with sight and mobility limitations while alert systems can be connected directly to cochlear implants worn by individuals with hearing impairments. [ 52 ] They can also be equipped with additional safety features, including sensors that monitor for medical emergencies such as falls or seizures . [ 53 ] Smart home technology applied in this way can provide users with more freedom and a higher quality of life. [ 51 ]"
Internet of things,https://en.wikipedia.org/wiki/Internet_of_things,"The term ""Enterprise IoT"" refers to devices used in business and corporate settings."
Internet of things,https://en.wikipedia.org/wiki/Internet_of_things,"The Internet of Medical Things ( IoMT ) is an application of the IoT for medical and health-related purposes, data collection and analysis for research, and monitoring. [ 54 ] [ 55 ] [ 56 ] [ 57 ] [ 58 ] The IoMT has been referenced as ""Smart Healthcare"", [ 59 ] as the technology for creating a digitized healthcare system, connecting available medical resources and healthcare services. [ 60 ] [ 61 ]"
Internet of things,https://en.wikipedia.org/wiki/Internet_of_things,"IoT devices can be used to enable remote health monitoring and emergency notification systems . These health monitoring devices can range from blood pressure and heart rate monitors to advanced devices capable of monitoring specialized implants, such as pacemakers, Fitbit electronic wristbands, or advanced hearing aids. [ 62 ] Some hospitals have begun implementing ""smart beds"" that can detect when they are occupied and when a patient is attempting to get up. It can also adjust itself to ensure appropriate pressure and support are applied to the patient without the manual interaction of nurses. [ 54 ] A 2015 Goldman Sachs report indicated that healthcare IoT devices ""can save the United States more than $300 billion in annual healthcare expenditures by increasing revenue and decreasing cost."" [ 63 ] Moreover, the use of mobile devices to support medical follow-up led to the creation of 'm-health', which is used to analyze health statistics. [ 64 ]"
Internet of things,https://en.wikipedia.org/wiki/Internet_of_things,"Specialized sensors can also be equipped within living spaces to monitor the health and general well-being of senior citizens, while ensuring that proper treatment is administered and assisting people in regaining lost mobility via therapy as well. [ 65 ] These sensors create a network of intelligent sensors that are able to collect, process, transfer, and analyze valuable information in different environments, such as connecting in-home monitoring devices to hospital-based systems. [ 59 ] Other consumer devices to encourage healthy living, such as connected scales or wearable heart monitors , are also a possibility with the IoT. [ 66 ] End-to-end health monitoring IoT platforms are also available for antenatal and chronic patients, helping one manage health vitals and recurring medication requirements. [ 67 ]"
Internet of things,https://en.wikipedia.org/wiki/Internet_of_things,"Advances in plastic and fabric electronics fabrication methods have enabled ultra-low-cost, use-and-throw IoMT sensors. These sensors, along with the required radio-frequency identification electronics, can be fabricated on paper or e-textiles for wireless powered disposable sensing devices. [ 68 ] Applications have been established for point-of-care medical diagnostics , where portability and low system complexity are considered essential. [ 69 ]"
Internet of things,https://en.wikipedia.org/wiki/Internet_of_things,"As of 2018 [update] , IoMT was being applied in the clinical laboratory industry. [ 56 ]"
Internet of things,https://en.wikipedia.org/wiki/Internet_of_things,"IoMT in the insurance industry provides access to better and new types of dynamic information. This includes sensor-based solutions such as biosensors, wearables, connected health devices, and mobile apps to track customer behavior. This can lead to more accurate underwriting and new pricing models. [ 70 ]"
Internet of things,https://en.wikipedia.org/wiki/Internet_of_things,The application of the IoT in healthcare plays a fundamental role in managing chronic diseases and in disease prevention and control. Remote monitoring is made possible through the connection of wireless solutions. The connectivity enables health practitioners to capture patients' data and apply algorithms in health data analysis. [ 71 ]
Internet of things,https://en.wikipedia.org/wiki/Internet_of_things,"The IoT can assist in the integration of communications, control, and information processing across various transportation systems . Application of the IoT extends to all aspects of transportation systems (i.e., the vehicle, [ 72 ] the infrastructure, and the driver or user). Dynamic interaction between these components of a transport system enables inter- and intra-vehicular communication, [ 73 ] smart traffic control , smart parking, electronic toll collection systems , logistics and fleet management , vehicle control , safety, and road assistance. [ 62 ] [ 74 ] In vehicle security applications, IoT-connected GPS trackers can operate for months or years on internal batteries, using low-power wide-area network protocols such as LTE-M to transmit location data to owners via smartphone applications when unauthorized movement is detected [ 75 ] ."
Internet of things,https://en.wikipedia.org/wiki/Internet_of_things,"In vehicular communication systems , vehicle-to-everything communication (V2X), consists of three main components: vehicle-to-vehicle communication (V2V), vehicle-to-infrastructure communication (V2I), and vehicle-to-pedestrian communication (V2P). Eventually, V2X is the first step to autonomous driving and connected road infrastructure. [ 76 ]"
Internet of things,https://en.wikipedia.org/wiki/Internet_of_things,"IoT devices can be used to monitor and control the mechanical, electrical, and electronic systems used in various types of buildings (e.g., public and private, industrial, institutions, or residential) [ 62 ] in home automation and building automation systems. In this context, three main areas are being covered in the literature: [ 77 ]"
Internet of things,https://en.wikipedia.org/wiki/Internet_of_things,"Also known as IIoT, industrial IoT devices acquire and analyze data from connected equipment, operational technology (OT), locations, and people. Combined with operational technology (OT) monitoring devices, IIoT helps regulate and monitor industrial systems. [ 78 ] Additionally, the same implementation can be carried out for automated record updates of asset placement in industrial storage units as the size of the assets can vary from a small screw to the whole motor spare part, and misplacement of such assets can cause a loss of manpower time and money."
Internet of things,https://en.wikipedia.org/wiki/Internet_of_things,"The IoT can connect various manufacturing devices equipped with sensing, identification, processing, communication, actuation, and networking capabilities. [ 79 ] Network control and management of manufacturing equipment , asset and situation management, or manufacturing process control enable IoT to be utilized for industrial applications and smart manufacturing. [ 80 ] IoT intelligent systems enable rapid manufacturing and optimization of new products and rapid response to product demands. [ 62 ]"
Internet of things,https://en.wikipedia.org/wiki/Internet_of_things,"Digital control systems , which aim to automate process controls, operator tools, and service information systems, alongside optimizing plant safety and security, fall within the purview of the IIoT . [ 81 ] Furthermore, IoT can also be applied to asset management via predictive maintenance , statistical evaluation , and measurements to maximize reliability. [ 82 ] Industrial management systems can be integrated with smart grids , enabling energy optimization. Measurements, automated controls, plant optimization, health and safety management, and other functions are provided by networked sensors. [ 62 ]"
Internet of things,https://en.wikipedia.org/wiki/Internet_of_things,"In addition to general manufacturing, IoT is also used for processes in the industrialization of construction. [ 83 ]"
Internet of things,https://en.wikipedia.org/wiki/Internet_of_things,"There are numerous IoT applications in farming [ 84 ] such as collecting data on temperature, rainfall, humidity, wind speed, pest infestation, and soil content. This data can be used to automate farming techniques, make informed decisions to improve quality and quantity, minimize risk and waste, and reduce the effort required to manage crops. For example, farmers can now monitor soil temperature and moisture from afar and even apply IoT-acquired data to precision fertilization programs. [ 85 ] The overall goal is that data from sensors, coupled with the farmer's knowledge and intuition about his or her farm, can help increase farm productivity, and also help reduce costs."
Internet of things,https://en.wikipedia.org/wiki/Internet_of_things,"In August 2018, Toyota Tsusho began a partnership with Microsoft to create fish farming tools using the Microsoft Azure application suite for IoT technologies related to water management. Developed in part by researchers from Kindai University , the water pump mechanisms use artificial intelligence to count the number of fish on a conveyor belt , analyze the number of fish, and deduce the effectiveness of water flow from the data the fish provide. [ 86 ] The FarmBeats project [ 87 ] from Microsoft Research that uses TV white space to connect farms is also a part of the Azure Marketplace now. [ 88 ]"
Internet of things,https://en.wikipedia.org/wiki/Internet_of_things,"IoT devices are in use to monitor the environments and systems of boats and yachts. [ 89 ] Many pleasure boats are left unattended for days in summer, and months in winter so such devices provide valuable early alerts of boat flooding, fire, and deep discharge of batteries."
