source_title,source_url,text
Internet of things,https://en.wikipedia.org/wiki/Internet_of_things,"Monitoring and controlling operations of sustainable urban and rural infrastructures like bridges, railway tracks and on- and offshore wind farms is a key application of the IoT. [ 81 ] The IoT infrastructure can be used for monitoring any events or changes in structural conditions that can compromise safety and increase risk. The IoT can benefit the construction industry by cost-saving, time reduction, better quality workday, paperless workflow and increase in productivity. It can help in taking faster decisions and saving money in Real-Time Data Analytics . It can also be used for scheduling repair and maintenance activities efficiently, by coordinating tasks between different service providers and users of these facilities. [ 62 ] IoT devices can also be used to control critical infrastructure like bridges to provide access to ships. The usage of IoT devices for monitoring and operating infrastructure is likely to significantly improve incident management and emergency response coordination, and quality of service , up-times and reduce costs of operation in all infrastructure-related areas. [ 90 ] Even areas such as waste management can benefit. [ 91 ]"
Internet of things,https://en.wikipedia.org/wiki/Internet_of_things,"There are several planned or ongoing large-scale deployments of the IoT, to enable better management of cities and systems. For example, Songdo , South Korea, the first fully equipped and wired smart city , is gradually being built, [ when? ] with approximately 70 percent of the business district completed as of June 2018 [update] . A sizeable portion of the city, the first of its kind, is planned to be wired and automated to operate with little or no human intervention. [ 92 ]"
Internet of things,https://en.wikipedia.org/wiki/Internet_of_things,"In 2014, another application was undergoing a project in Santander , Spain. For this deployment, two approaches have been adopted. This city of 180,000 inhabitants has already seen 18,000 downloads of its city smartphone app. The app is connected to 10,000 sensors that enable services like parking search and environmental monitoring. Additionally, city context information is used in this deployment, aiming to benefit merchants through a spark deals mechanism based on city behavior that aims at maximizing the impact of each notification. [ 93 ]"
Internet of things,https://en.wikipedia.org/wiki/Internet_of_things,"Other examples of large-scale deployments underway include the Sino-Singapore Guangzhou Knowledge City; [ 94 ] work on improving air and water quality, reducing noise pollution, and increasing transportation efficiency in San Jose, California ; [ 95 ] and smart traffic management in western Singapore. [ 96 ] Using its RPMA (Random Phase Multiple Access) technology, San Diego–based Ingenu has built a nationwide public network [ 97 ] for low- bandwidth data transmissions using the same unlicensed 2.4 gigahertz spectrum as Wi-Fi. Ingenu's ""Machine Network"" covers more than a third of the US population across 35 major cities including San Diego and Dallas. [ 98 ] French company, Sigfox , commenced building an Ultra Narrowband wireless data network in the San Francisco Bay Area in 2014, the first business to achieve such a deployment in the U.S. [ 99 ] [ 100 ] It subsequently announced it would set up a total of 4000 base stations to cover a total of 30 cities in the U.S. by the end of 2016, making it the largest IoT network coverage provider in the country thus far. [ 101 ] [ 102 ] Cisco also participates in smart cities projects. Cisco has deployed technologies for Smart Wi-Fi, Smart Safety & Security, Smart Lighting , Smart Parking, Smart Transports, Smart Bus Stops, Smart Kiosks, Remote Expert for Government Services (REGS) and Smart Education in the five km area in the city of Vijayawada , India. [ 103 ] [ 104 ]"
Internet of things,https://en.wikipedia.org/wiki/Internet_of_things,"Another example of a large deployment is the one completed by New York Waterways in New York City to connect all the city's vessels and be able to monitor them live 24/7. The network was designed and engineered by Fluidmesh Networks , a Chicago-based company developing wireless networks for critical applications. The NYWW network is currently providing coverage on the Hudson River, East River, and Upper New York Bay. With the wireless network in place, NY Waterway is able to take control of its fleet and passengers in a way that was not previously possible. New applications can include security, energy and fleet management, digital signage, public Wi-Fi, paperless ticketing and others. [ 105 ]"
Internet of things,https://en.wikipedia.org/wiki/Internet_of_things,"Significant numbers of energy-consuming devices (e.g. lamps, household appliances, motors, pumps, etc.) already integrate Internet connectivity, which can allow them to communicate with utilities not only to balance power generation but also helps optimize the energy consumption as a whole. [ 62 ] These devices allow for remote control by users, or central management via a cloud -based interface, and enable functions like scheduling (e.g., remotely powering on or off heating systems, controlling ovens, changing lighting conditions etc.). [ 62 ] The smart grid is a utility-side IoT application; systems gather and act on energy and power-related information to improve the efficiency of the production and distribution of electricity. [ 106 ] Using advanced metering infrastructure (AMI) Internet-connected devices, electric utilities not only collect data from end-users, but also manage distribution automation devices like transformers. [ 62 ]"
Internet of things,https://en.wikipedia.org/wiki/Internet_of_things,"Environmental monitoring applications of the IoT typically use sensors to assist in environmental protection [ 107 ] by monitoring air or water quality , [ 108 ] atmospheric or soil conditions , [ 109 ] and can even include areas like monitoring the movements of wildlife and their habitats . [ 110 ] Development of resource-constrained devices connected to the Internet also means that other applications like earthquake or tsunami early-warning systems can also be used by emergency services to provide more effective aid. IoT devices in this application typically span a large geographic area and can also be mobile. [ 62 ] It has been argued that the standardization that IoT brings to wireless sensing will revolutionize this area. [ 111 ]"
Internet of things,https://en.wikipedia.org/wiki/Internet_of_things,"Another example of integrating the IoT is the concept of a ""living lab."" Living labs integrate and combine research and innovation processes, establishing within a public-private-people-partnership. [ 112 ] Between 2006 and January 2024, there were over 440 living labs (though not all are currently active) [ 113 ] that use the IoT to collaborate and share knowledge between stakeholders to co-create innovative and technological products. When companies intend to implement and develop IoT services [ 114 ] for smart cities, they need to have economic incentives. The US government plays a key role in smart city projects; changes in policies will help cities to implement the IoT which provides effectiveness, efficiency, and accuracy of the resources that are being used. For instance, the US government provides tax incentives and affordable rent, improves public transport, and offers an environment where start-up companies, creative industries, and multinationals may co-create, share a common infrastructure and labor markets, and take advantage of locally embedded technologies, production processes, and transaction costs. [ 112 ]"
Internet of things,https://en.wikipedia.org/wiki/Internet_of_things,"The Internet of Military Things (IoMT) is the application of IoT technologies in the military domain for the purposes of reconnaissance, surveillance, and other combat-related objectives. It is heavily influenced by the future prospects of warfare in an urban environment and involves the use of sensors, munitions , vehicles, robots, human-wearable biometrics, and other smart technology that is relevant on the battlefield. [ 115 ]"
Internet of things,https://en.wikipedia.org/wiki/Internet_of_things,"One of the examples of IOT devices used in the military is the Xaver 1000 system. The Xaver 1000 was developed by Israel's Camero Tech, which is the latest in the company's line of ""through-wall imaging systems."" The Xaver line uses millimeter wave (MMW) radar, or radar in the range of 30-300 gigahertz. It is equipped with an AI-based life target tracking system as well as its own 3D 'sense-through-the-wall' technology. [ 116 ]"
Internet of things,https://en.wikipedia.org/wiki/Internet_of_things,"The Internet of Battlefield Things ( IoBT ) is a project initiated and executed by the U.S. Army Research Laboratory (ARL) that focuses on the basic science related to the IoT that enhances the capabilities of Army soldiers. [ 117 ] In 2017, ARL launched the Internet of Battlefield Things Collaborative Research Alliance (IoBT-CRA) , establishing a working collaboration between industry, university, and Army researchers to advance the theoretical foundations of IoT technologies and their applications to Army operations. [ 118 ] [ 119 ]"
Internet of things,https://en.wikipedia.org/wiki/Internet_of_things,"The Ocean of Things project is a DARPA -led program designed to establish an Internet of things across large ocean areas for the purposes of collecting, monitoring, and analyzing environmental and vessel activity data. The project entails the deployment of about 50,000 floats that house a passive sensor suite that autonomously detects and tracks military and commercial vessels as part of a cloud-based network. [ 120 ]"
Internet of things,https://en.wikipedia.org/wiki/Internet_of_things,"There are several applications of smart or active packaging in which a QR code or NFC tag is affixed to a product or its packaging. The tag itself is passive; however, it contains a unique identifier (typically a URL ) which enables a user to access digital content about the product via a smartphone. [ 121 ] Strictly speaking, such passive items are not part of the Internet of things, but they can be seen as enablers of digital interactions. [ 122 ] The term ""Internet of Packaging"" has been coined to describe applications in which unique identifiers are used, to automate supply chains, and are scanned on large scale by consumers to access digital content. [ 123 ] Authentication of the unique identifiers, and thereby of the product itself, is possible via a copy-sensitive digital watermark or copy detection pattern for scanning when scanning a QR code, [ 124 ] while NFC tags can encrypt communication. [ 125 ]"
Internet of things,https://en.wikipedia.org/wiki/Internet_of_things,"In the Internet of Things (IoT), As of April 2026 [update] , the number of devices connected and controlled via the Internet has increased. [ 126 ] Applications of IoT technology vary across devices, but many share common characteristics."
Internet of things,https://en.wikipedia.org/wiki/Internet_of_things,"The IoT creates opportunities for more direct integration of the physical world into computer-based systems, resulting in efficiency improvements, economic benefits, and reduced human exertions. [ 127 ] [ 128 ] [ 129 ] [ 130 ]"
Internet of things,https://en.wikipedia.org/wiki/Internet_of_things,"IoT Analytics reported there were 16.6 billion IoT devices connected in 2023. In 2020, the same firm projected there would be 30 billion devices connected by 2025. As of October, 2024, there are around 17 billion. [ 131 ] [ 132 ] [ 133 ]"
Internet of things,https://en.wikipedia.org/wiki/Internet_of_things,"Ambient intelligence and autonomous control are not part of the original concept of the Internet of things. Ambient intelligence and autonomous control do not necessarily require Internet structures, either. However, there is a shift in research (by companies such as Intel ) to integrate the concepts of the IoT and autonomous control, with initial outcomes towards this direction considering objects as the driving force for autonomous IoT. [ 134 ] An approach in this context is deep reinforcement learning where most of IoT systems provide a dynamic and interactive environment. [ 135 ] Training an agent (i.e., IoT device) to behave smartly in such an environment cannot be addressed by conventional machine learning algorithms such as supervised learning . By reinforcement learning approach, a learning agent can sense the environment's state (e.g., sensing home temperature), perform actions (e.g., turn HVAC on or off) and learn through the maximizing accumulated rewards it receives in long term."
Internet of things,https://en.wikipedia.org/wiki/Internet_of_things,"IoT intelligence can be offered at three levels: IoT devices, Edge/Fog nodes , and cloud computing . [ 136 ] The need for intelligent control and decision at each level depends on the time sensitiveness of the IoT application. For example, an autonomous vehicle's camera needs to make real-time obstacle detection to avoid an accident. This fast decision making would not be possible through transferring data from the vehicle to cloud instances and return the predictions back to the vehicle. Instead, all the operation should be performed locally in the vehicle. Integrating advanced machine learning algorithms including deep learning into IoT devices is an active research area to make smart objects closer to reality. Moreover, it is possible to get the most value out of IoT deployments through analyzing IoT data, extracting hidden information, and predicting control decisions. A wide variety of machine learning techniques have been used in IoT domain ranging from traditional methods such as regression , support vector machine , and random forest to advanced ones such as convolutional neural networks , LSTM , and variational autoencoder . [ 137 ] [ 136 ]"
Internet of things,https://en.wikipedia.org/wiki/Internet_of_things,"In the future, the Internet of things may be a non-deterministic and open network in which auto-organized or intelligent entities ( web services , SOA components) and virtual objects (avatars) will be interoperable and able to act independently (pursuing their own objectives or shared ones) depending on the context, circumstances or environments. Autonomous behavior through the collection and reasoning of context information as well as the object's ability to detect changes in the environment (faults affecting sensors) and introduce suitable mitigation measures constitutes a major research trend, [ 138 ] clearly needed to provide credibility to the IoT technology. Modern IoT products and solutions in the marketplace use a variety of different technologies to support such context-aware automation, but more sophisticated forms of intelligence are requested to permit sensor units and intelligent cyber-physical systems to be deployed in real environments. [ 139 ]"
Internet of things,https://en.wikipedia.org/wiki/Internet_of_things,"IoT system architecture, in its simplistic view, consists of three tiers: Tier 1: Devices, Tier 2: the Edge Gateway , and Tier 3: the Cloud. [ 140 ] Devices include networked things, such as the sensors and actuators found in IoT equipment, particularly those that use protocols such as Modbus , Bluetooth , Zigbee , or proprietary protocols, to connect to an Edge Gateway. [ 140 ] The Edge Gateway layer consists of sensor data aggregation systems called Edge Gateways that provide functionality, such as pre-processing of the data, securing connectivity to cloud, using systems such as WebSockets, the event hub, and, even in some cases, edge analytics or fog computing . [ 140 ] Edge Gateway layer is also required to give a common view of the devices to the upper layers to facilitate in easier management. The final tier includes the cloud application built for IoT using the microservices architecture, which are usually polyglot and inherently secure in nature using HTTPS/ OAuth . It includes various database systems that store sensor data, such as time series databases or asset stores using backend data storage systems (e.g. Cassandra, PostgreSQL). [ 140 ] The cloud tier in most cloud-based IoT system features event queuing and messaging system that handles communication that transpires in all tiers. [ 141 ] Some experts classified the three-tiers in the IoT system as edge, platform, and enterprise and these are connected by proximity network, access network, and service network, respectively. [ 142 ]"
Internet of things,https://en.wikipedia.org/wiki/Internet_of_things,"IoT requires huge scalability in the network space to handle the surge of devices. [ 143 ] IETF 6LoWPAN can be used to connect devices to IP networks. With billions of devices [ 144 ] being added to the Internet space, IPv6 may play an important role in handling the network layer scalability. IETF's Constrained Application Protocol , ZeroMQ , and MQTT can provide lightweight data transport. In practice, many groups of IoT devices are hidden behind gateway nodes and may not have unique addresses. Also, the vision of everything being interconnected is not needed for most applications as it is mainly the data which needs interconnecting at a higher layer. [ citation needed ]"
Internet of things,https://en.wikipedia.org/wiki/Internet_of_things,Fog computing is a viable alternative to prevent such a large burst of data flow through the Internet. [ 145 ] The edge devices ' computation power to analyze and process data is extremely limited. Limited processing power is a key attribute of IoT devices as their purpose is to supply data about physical objects while remaining autonomous. Heavy processing requirements use more battery power harming IoT's ability to operate. Scalability is easy because IoT devices simply supply data through the Internet to a server with sufficient processing power. [ 146 ]
Internet of things,https://en.wikipedia.org/wiki/Internet_of_things,"Decentralized Internet of things, or decentralized IoT, is a modified IoT which utilizes fog computing to handle and balance requests of connected IoT devices in order to reduce loading on the cloud servers and improve responsiveness for latency-sensitive IoT applications like vital signs monitoring of patients, vehicle-to-vehicle communication of autonomous driving, and critical failure detection of industrial devices. [ 147 ] Performance is improved, especially for huge IoT systems with millions of nodes. [ 148 ]"
Internet of things,https://en.wikipedia.org/wiki/Internet_of_things,"Conventional IoT is connected via a mesh network and led by a major head node (centralized controller). [ 149 ] The head node decides how a data is created, stored, and transmitted. [ 150 ] In contrast, decentralized IoT attempts to divide IoT systems into smaller divisions. [ 151 ] The head node authorizes partial decision-making power to lower level sub-nodes under mutual agreed policy. [ 152 ]"
Internet of things,https://en.wikipedia.org/wiki/Internet_of_things,"Some approaches to decentralized IoT attempt to address the limited bandwidth and hashing capacity of battery-powered devices via blockchain , although traditional linear chains often struggle with the throughput required for billions of devices. [ 153 ] To resolve this, recent research focuses on sharded distributed ledger protocols (such as Cerberus) that utilize braided synchronization. These protocols theoretically allow network throughput to scale linearly with the number of nodes, enabling the massive concurrency required for autonomous machine-to-machine transactions. [ 154 ]"
Internet of things,https://en.wikipedia.org/wiki/Internet_of_things,"In semi-open or closed loops (i.e., value chains, whenever a global finality can be settled) the IoT is often analyzed as a complex system [ 155 ] due to the large number of different interactions between autonomous actors, and its capacity to integrate new actors. At the overall stage (full open loop) it will likely be seen as a chaotic environment (since systems always have finality)."
Internet of things,https://en.wikipedia.org/wiki/Internet_of_things,"As a practical approach, not all elements on the Internet of things run in a global, public space. Subsystems are often implemented to mitigate the risks of privacy, control and reliability. For example, domestic robotics (domotics) running inside a smart home might only share data within and be available via a local network . [ 156 ] Managing and controlling a high dynamic ad hoc IoT things/devices network is a complex task within traditional network architecture, software-defined networking (SDN) provides a dynamic approach that better fits the special requirements of IoT applications. [ 157 ] [ 158 ]"
Internet of things,https://en.wikipedia.org/wiki/Internet_of_things,"The exact scale of the Internet of things is unknown, with quotes of billions or trillions often quoted at the beginning of IoT articles. In 2015 there were 83 million smart devices in people's homes. This number is expected to grow to 193 million devices by 2020. [ 43 ] [ 159 ] In 2023, the number of connected IoT devices will reach 16.6 billion. [ 160 ]"
Internet of things,https://en.wikipedia.org/wiki/Internet_of_things,The figure of online capable devices grew 31% from 2016 to 2017 to reach 8.4 billion. [ 161 ]
Internet of things,https://en.wikipedia.org/wiki/Internet_of_things,"In the Internet of things, the precise geographic location of a thing—and also the precise geographic dimensions of a thing—can be critical. [ 162 ] Therefore, facts about a thing, such as its location in time and space, have been less critical to track because the person processing the information can decide whether or not that information was important to the action being taken, and if so, add the missing information (or decide to not take the action). (Note that some things on the Internet of things will be sensors, and sensor location is usually important. [ 163 ] ) The GeoWeb and Digital Earth are applications that become possible when things can become organized and connected by location. However, the challenges that remain include the constraints of variable spatial scales, the need to handle massive amounts of data, and an indexing for fast search and neighbour operations. On the Internet of things, if things are able to take actions on their own initiative, this human-centric mediation role is eliminated. Thus, the time-space context that we as humans take for granted must be given a central role in this information ecosystem . Just as standards play a key role on the Internet and the Web, geo-spatial standards will play a key role on the Internet of things. [ 164 ] [ 165 ]"
Internet of things,https://en.wikipedia.org/wiki/Internet_of_things,"Many IoT devices have the potential to take a piece of this market. Jean-Louis Gassée (Apple initial alumni team, and BeOS co-founder) has addressed this topic in an article on Monday Note , [ 166 ] where he predicts that the most likely problem will be what he calls the ""basket of remotes"" problem, where we'll have hundreds of applications to interface with hundreds of devices that don't share protocols for speaking with one another. [ 166 ] For improved user interaction, some technology leaders are joining forces to create standards for communication between devices to solve this problem. Others are turning to the concept of predictive interaction of devices, ""where collected data is used to predict and trigger actions on the specific devices"" while making them work together. [ 167 ]"
Internet of things,https://en.wikipedia.org/wiki/Internet_of_things,"Social Internet of things (SIoT) is a new kind of IoT that focuses the importance of social interaction and relationship between IoT devices. [ 168 ] SIoT is a pattern of how cross-domain IoT devices enabling application to application communication and collaboration without human intervention in order to serve their owners with autonomous services, [ 169 ] and this only can be realized when gained low-level architecture support from both IoT software and hardware engineering . [ 170 ]"
Internet of things,https://en.wikipedia.org/wiki/Internet_of_things,IoT defines a device with an identity like a citizen in a community and connect them to the Internet to provide services to its users. [ 171 ] SIoT defines a social network for IoT devices only to interact with each other for different goals that to serve human. [ 172 ]
Internet of things,https://en.wikipedia.org/wiki/Internet_of_things,"SIoT is different from the original IoT in terms of the collaboration characteristics. IoT is passive, it was set to serve for dedicated purposes with existing IoT devices in predetermined system. SIoT is active, it was programmed and managed by AI to serve for unplanned purposes with mix and match of potential IoT devices from different systems that benefit its users. [ 173 ]"
Internet of things,https://en.wikipedia.org/wiki/Internet_of_things,"IoT devices with built-in sociability are able to broadcast their abilities or functionality, which can be used to discover and share information with other IoT devices in the same or nearby network, realizing SIoT. [ 174 ] Facilitating further functionality with these abilities could be helpful during emergencies. [ 175 ]"
Internet of things,https://en.wikipedia.org/wiki/Internet_of_things,"There are many technologies that enable the IoT. Crucial to the field is the network used to communicate between devices of an IoT installation, a role that several wireless or wired technologies may fulfill: [ 182 ] [ 183 ] [ 184 ]"
