source_title,source_url,text
Surveillance,https://en.wikipedia.org/wiki/Surveillance,"Data mining is the application of statistical techniques and programmatic algorithms to discover previously unnoticed relationships within the data. Data profiling in this context is the process of assembling information about a particular individual or group in order to generate a profile — that is, a picture of their patterns and behavior. Data profiling can be an extremely powerful tool for psychological and social network analysis . A skilled analyst can discover facts about a person that they might not even be consciously aware of themselves. [ 98 ]"
Surveillance,https://en.wikipedia.org/wiki/Surveillance,"Economic (such as credit card purchases) and social (such as telephone calls and emails) transactions in modern society create large amounts of stored data and records. In the past, this data was documented in paper records, leaving a "" paper trail "", or was simply not documented at all. Correlation of paper-based records was a laborious process—it required human intelligence operators to manually dig through documents, which was time-consuming and incomplete, at best."
Surveillance,https://en.wikipedia.org/wiki/Surveillance,"But today many of these records are electronic, resulting in an "" electronic trail "". Every use of a bank machine, payment by credit card, use of a phone card, call from home, checked out library book, rented video, or otherwise complete recorded transaction generates an electronic record. Public records—such as birth, court, tax and other records—are increasingly being digitized and made available online. In addition, due to laws like CALEA , web traffic and online purchases are also available for profiling. Electronic record-keeping makes data easily collectable, storable, and accessible—so that high-volume, efficient aggregation and analysis is possible at significantly lower costs."
Surveillance,https://en.wikipedia.org/wiki/Surveillance,"Information relating to many of these individual transactions is often easily available because it is generally not guarded in isolation, since the information, such as the title of a movie a person has rented, might not seem sensitive. However, when many such transactions are aggregated they can be used to assemble a detailed profile revealing the actions, habits, beliefs, locations frequented, social connections , and preferences of the individual. This profile is then used, by programs such as ADVISE [ 99 ] and TALON , to determine whether the person is a military, criminal, or political threat."
Surveillance,https://en.wikipedia.org/wiki/Surveillance,"In addition to its own aggregation and profiling tools, the government is able to access information from third parties—for example, banks, credit companies or employers, etc.—by requesting access informally, by compelling access through the use of subpoenas or other procedures, [ 100 ] or by purchasing data from commercial data aggregators or data brokers. The United States has spent $370 million on its 43 planned fusion centers , which are national network of surveillance centers that are located in over 30 states. The centers will collect and analyze vast amounts of data on U.S. citizens. It will get this data by consolidating personal information from sources such as state driver's licensing agencies, hospital records, criminal records, school records, credit bureaus, banks, etc.—and placing this information in a centralized database that can be accessed from all of the centers, as well as other federal law enforcement and intelligence agencies. [ 101 ]"
Surveillance,https://en.wikipedia.org/wiki/Surveillance,"Under United States v. Miller (1976), data held by third parties is generally not subject to Fourth Amendment warrant requirements ( third-party doctrine )."
Surveillance,https://en.wikipedia.org/wiki/Surveillance,A tail may surreptitiously track and report on the movements and contacts of a person of interest. Such following by one or more people may provide useful in formation in relatively densely populated urban environments. [ 102 ]
Surveillance,https://en.wikipedia.org/wiki/Surveillance,Organizations that have enemies who wish to gather information about the groups' members or activities face the issue of potential infiltration. [ 103 ]
Surveillance,https://en.wikipedia.org/wiki/Surveillance,"In addition to operatives' infiltrating an organization, the surveilling party may exert pressure on certain members of the target organization to act as informants (i.e., to disclose the information they hold on the organization and its members). [ 104 ] [ 105 ]"
Surveillance,https://en.wikipedia.org/wiki/Surveillance,"Fielding operatives is very expensive, and governments with wide-reaching electronic surveillance tools at their disposal, rather than gathering the sort of information which operatives can provide, may use less problematic forms of surveillance—such as those mentioned above. Nevertheless, the use of human infiltrators remains common. For instance, in 2007 documents surfaced showing that the FBI planned to field a total of 15,000 undercover agents and informants in response to an anti-terrorism directive (issued by President George W. Bush in 2004) that ordered intelligence and law-enforcement agencies to increase their HUMINT capabilities. [ 106 ]"
Surveillance,https://en.wikipedia.org/wiki/Surveillance,"In some home invasion cases, thieves may use "" casing surveillance ” to determine if a victim's property such as a collection of firearms are worth stealing. [ 107 ]"
Surveillance,https://en.wikipedia.org/wiki/Surveillance,"On May 25, 2007, the U.S. Director of National Intelligence Michael McConnell authorized the National Applications Office (NAO) of the Department of Homeland Security to allow local, state, and domestic Federal agencies to access imagery from military intelligence Reconnaissance satellites and Reconnaissance aircraft sensors which can now be used to observe the activities of U.S. citizens. The satellites and aircraft sensors will be able to penetrate cloud cover, detect chemical traces, and identify objects in buildings and ""underground bunkers"", and will provide real-time video at much higher resolutions than the still-images produced by programs such as Google Earth . [ 108 ] [ 109 ] [ 110 ] [ 111 ] [ 112 ] [ 113 ]"
Surveillance,https://en.wikipedia.org/wiki/Surveillance,"One of the simplest forms of identification is the carrying of credentials. Some nations have an identity card system to aid identification, whilst others are considering it but face public opposition. Other documents, such as passports , driver's licenses , library cards , banking or credit cards are also used to verify identity."
Surveillance,https://en.wikipedia.org/wiki/Surveillance,"If the form of the identity card is ""machine-readable"", usually using an encoded magnetic stripe or identification number (such as a Social Security number ), it corroborates the subject's identifying data. In this case it may create an electronic trail when it is checked and scanned, which can be used in profiling, as mentioned above."
Surveillance,https://en.wikipedia.org/wiki/Surveillance,This section refers to methods that involve the monitoring of tracking devices through the aid of wireless signals.
Surveillance,https://en.wikipedia.org/wiki/Surveillance,"Mobile carrier antennas are also commonly used to collect geolocation data on mobile phones. The geographical location of a powered mobile phone (and thus the person carrying it) can be determined easily (whether it is being used or not), using a technique known as multilateration to calculate the differences in time for a signal to travel from the cell phone to each of several cell towers near the owner of the phone. [ 31 ] [ 32 ] Dr. Victor Kappeler [ 114 ] of Eastern Kentucky University indicates that police surveillance is a strong concern, stating the following statistics from 2013:"
Surveillance,https://en.wikipedia.org/wiki/Surveillance,"Of the 321,545 law enforcement requests made to Verizon, 54,200 of these requests were for ""content"" or ""location"" information—not just cell phone numbers or IP addresses. Content information included the actual text of messages, emails and the wiretapping of voice or messaging content in real-time."
Surveillance,https://en.wikipedia.org/wiki/Surveillance,"A comparatively new off-the-shelf surveillance device is an IMSI-catcher , a telephone eavesdropping device used to intercept mobile phone traffic and track the movement of mobile phone users. Essentially a ""fake"" mobile tower acting between the target mobile phone and the service provider's real towers, it is considered a man-in-the-middle (MITM) attack. IMSI-catchers are used in some countries by law enforcement and intelligence agencies , but their use has raised significant civil liberty and privacy concerns and is strictly regulated in some countries. [ 115 ]"
Surveillance,https://en.wikipedia.org/wiki/Surveillance,"In March 2020, British daily The Guardian , based on the claims of a whistleblower , accused the government of Saudi Arabia of exploiting global mobile telecom network weaknesses to spy on its citizens traveling around the United States. [ 116 ] The data shared by the whistleblower in support of the claims, showed that a systematic spying campaign was being run by the kingdom exploiting the flaws of SS7 , a global messaging system. The data showed that millions of secret tracking commands originated from Saudi in a duration of four-months, starting from November 2019. [ 117 ]"
Surveillance,https://en.wikipedia.org/wiki/Surveillance,"Radio-frequency identification (RFID) tagging is the use of very small electronic devices (called ""RFID tags"") which are applied to or incorporated into a product, animal, or person for the purpose of identification and tracking using radio waves. The tags can be read from several meters away. They are extremely inexpensive, costing a few cents per piece, so they can be inserted into many types of everyday products without significantly increasing the price, and can be used to track and identify these objects for a variety of purposes."
Surveillance,https://en.wikipedia.org/wiki/Surveillance,"Some companies appear to be ""tagging"" their workers by incorporating RFID tags in employee ID badges. Workers in U.K. considered strike action in protest of having themselves tagged; they felt that it was dehumanizing to have all of their movements tracked with RFID chips. [ 118 ] [ vague ] Some critics have expressed fears that people will soon be tracked and scanned everywhere they go. [ 119 ] On the other hand, RFID tags in newborn baby ID bracelets put on by hospitals have foiled kidnappings. [ 118 ]"
Surveillance,https://en.wikipedia.org/wiki/Surveillance,"In a 2003 editorial, CNET News.com's chief political correspondent, Declan McCullagh, speculated that, soon, every object that is purchased, and perhaps ID cards, will have RFID devices in them, which would respond with information about people as they walk past scanners (what type of phone they have, what type of shoes they have on, which books they are carrying, what credit cards or membership cards they have, etc.). This information could be used for identification, tracking, or targeted marketing . As of 2021 [update] , this has largely not come to pass. [ 120 ]"
Surveillance,https://en.wikipedia.org/wiki/Surveillance,"A human microchip implant is an identifying integrated circuit device or RFID transponder encased in silicate glass and implanted in the body of a human being. A subdermal implant typically contains a unique ID number that can be linked to information contained in an external database, such as personal identification, medical history, medications, allergies, and contact information."
Surveillance,https://en.wikipedia.org/wiki/Surveillance,"A few people have proposed implanting RFID tags or hypothetical tiny GPS devices to monitor the locations of convicted criminals, such as murderers and sex offenders, [ 121 ] but these proposals have typically been met with objections from human rights advocates. [ 122 ] [ 123 ] [ 124 ]"
Surveillance,https://en.wikipedia.org/wiki/Surveillance,"Verichip is an RFID device produced by a company called Applied Digital Solutions (ADS). Verichip is slightly larger than a grain of rice, and is injected under the skin. The injection reportedly feels similar to receiving a shot . The chip is encased in glass, and stores a ""VeriChip Subscriber Number"" which the scanner uses to access their personal information, via the Internet, from Verichip Inc.'s database, the ""Global VeriChip Subscriber Registry"". Thousands of people have already had them inserted. [ 119 ] In Mexico, for example, 160 workers at the Attorney General's office were required to have the chip injected for identity verification and access control purposes. [ 125 ] [ 126 ]"
Surveillance,https://en.wikipedia.org/wiki/Surveillance,"Implantable microchips have also been used in healthcare settings, but ethnographic researchers have identified a number of ethical problems with such uses; these problems include unequal treatment, diminished trust, and possible endangerment of patients. [ 127 ]"
Surveillance,https://en.wikipedia.org/wiki/Surveillance,"Perimeter surveillance radar (PSR) is a class of radar sensors that monitor activity surrounding or on critical infrastructure areas such as airports, [ 128 ] seaports, military installations, national borders, refineries and other critical industry and the like.  Such radars are characterized by their ability to detect movement at ground level of targets such as an individual walking or crawling towards a facility.  Such radars typically have ranges of several hundred metres to over 10 kilometres. [ 129 ]"
Surveillance,https://en.wikipedia.org/wiki/Surveillance,"Alternate technologies include laser-based systems. These have the potential for very high target position accuracy, however they are less effective in the presence of fog and other obscurants."
Surveillance,https://en.wikipedia.org/wiki/Surveillance,"In the U.S., police have planted hidden GPS tracking devices in people's vehicles to monitor their movements, [ 130 ] without a warrant. [ 131 ] In early 2009, they were arguing in court that they have the right to do this. [ 132 ]"
Surveillance,https://en.wikipedia.org/wiki/Surveillance,Several cities are running pilot projects to require parolees to wear GPS devices to track their movements when they get out of prison. [ 133 ]
Surveillance,https://en.wikipedia.org/wiki/Surveillance,"Covert listening devices and video devices, or ""bugs"", are hidden electronic devices which are used to capture, record, and/or transmit data to a receiving party such as a law enforcement agency."
Surveillance,https://en.wikipedia.org/wiki/Surveillance,"The U.S. has run numerous domestic intelligence operations, such as COINTELPRO , which have bugged the homes, offices, and vehicles of thousands of U.S. citizens, usually political activists , subversives , and criminals . [ 134 ]"
Surveillance,https://en.wikipedia.org/wiki/Surveillance,"Law enforcement and intelligence services in the U.K. and the United States possess technology to remotely activate the microphones in cell phones, by accessing the phone's diagnostic/maintenance features, in order to listen to conversations that take place nearby the person who holds the phone. [ 25 ] [ 26 ] [ 27 ]"
Surveillance,https://en.wikipedia.org/wiki/Surveillance,"As more people use faxes and e-mail the significance of surveilling the postal system is decreasing, in favor of Internet and telephone surveillance. But interception of post is still an available option for law enforcement and intelligence agencies, in certain circumstances. [ 135 ] This is not a common practice, however, and entities like the US Army require high levels of approval to conduct. [ 136 ]"
Surveillance,https://en.wikipedia.org/wiki/Surveillance,"The U.S. Central Intelligence Agency and Federal Bureau of Investigation have performed twelve separate mail-opening campaigns targeted towards U.S. citizens. In one of these programs, more than 215,000 communications were intercepted, opened, and photographed. [ 137 ] [ 138 ]"
Surveillance,https://en.wikipedia.org/wiki/Surveillance,A stakeout is the coordinated surveillance of a location or person. Stakeouts are generally performed covertly and for the purpose of gathering evidence related to criminal activity . The term derives from the practice by land surveyors of using survey stakes to measure out an area before the main building project begins.
Surveillance,https://en.wikipedia.org/wiki/Surveillance,"The Internet of Things (IoT), is a network of physical devices. These devices can collect data to one another without human intervention. IoTs can be used for identification, monitoring, location tracking, and health tracking. [ 139 ] While IoTs can be used as time-saving tools that make activities simpler, they raise the concern of government surveillance and privacy regarding how data will be used. [ 139 ]"
Surveillance,https://en.wikipedia.org/wiki/Surveillance,"Supporters of surveillance systems believe that these tools can help protect society from terrorists and criminals . They argue that surveillance can reduce crime by three means: by deterrence, by observation, and by reconstruction. Surveillance can deter by increasing the chance of being caught, and by revealing the modus operandi . This requires a minimal level of invasiveness. [ 140 ]"
Surveillance,https://en.wikipedia.org/wiki/Surveillance,"Another method on how surveillance can be used to fight criminal activity is by linking the information stream obtained from them to a recognition system (for instance, a camera system that has its feed run through a facial recognition system). This can for instance auto-recognize fugitives and direct police to their location."
Surveillance,https://en.wikipedia.org/wiki/Surveillance,"A distinction here has to be made however on the type of surveillance employed. Some people that support video surveillance in city streets may not support indiscriminate telephone taps and vice versa. Besides the types, the way in which this surveillance is done also matters a lot; i.e. indiscriminate telephone taps are supported by much fewer people than say telephone taps done only to people suspected of engaging in illegal activities."
Surveillance,https://en.wikipedia.org/wiki/Surveillance,"Surveillance can also be used to give human operatives a tactical advantage through improved situational awareness, or through the use of automated processes, i.e. video analytics . Surveillance can help reconstruct an incident and prove guilt through the availability of footage for forensics experts. Surveillance can also influence subjective security if surveillance resources are visible or if the consequences of surveillance can be felt."
Surveillance,https://en.wikipedia.org/wiki/Surveillance,"Some of the surveillance systems (such as the camera system that has its feed run through a facial recognition system mentioned above) can also have other uses besides countering criminal activity. For instance, it can help in retrieving runaway children, abducted or missing adults and mentally disabled people. 
Other supporters simply believe that there is nothing that can be done about the loss of privacy, and that people must become accustomed to having no privacy. As Sun Microsystems CEO Scott McNealy said: ""You have zero privacy anyway. Get over it."" [ 141 ] [ 142 ]"
Surveillance,https://en.wikipedia.org/wiki/Surveillance,"Another common argument is: "" If you aren't doing something wrong then you don't have anything to fear ."" That is, one does not have a right to privacy regarding illegal activities, while those following the law suffer no harm from surveillance and so have no standing to object to it. [ 143 ] Legal scholar Daniel J. Solove described this argument as ""[balancing] the degree to which an individual's privacy is compromised by the limited disclosure of certain information against potent national security interests"". [ 143 ] However, Solove, who published the book Nothing to Hide (2011) with a critique of this argument, also says ""this issue is not about whether the information gathered is something people want to hide, but rather about the power and the structure of government"", including ""what kinds of oversight and accountability we want in place when the government engages in searches and seizures"". [ 143 ]"
Surveillance,https://en.wikipedia.org/wiki/Surveillance,"With the advent of programs such as the Total Information Awareness program and ADVISE , technologies such as high speed surveillance computers and biometrics software, and laws such as the Communications Assistance for Law Enforcement Act , governments now possess an unprecedented ability to monitor the activities of their subjects. [ 144 ] Many civil rights and privacy groups, such as the Electronic Frontier Foundation and American Civil Liberties Union , have expressed concern that by allowing continual increases in government surveillance of citizens we will end up in a mass surveillance society, with extremely limited, or non-existent political and/or personal freedoms. Fears such as this have led to numerous lawsuits such as Hepting v. AT&T . [ 144 ] [ 145 ] Whistleblowers and journalists have also documented significant cases of surveillance abuse ."
Surveillance,https://en.wikipedia.org/wiki/Surveillance,"Some critics state that the ""nothing to hide"" claim made by supporters should be modified to read: ""As long as we do what we're told, we have nothing to fear."" For instance, a person who is part of a political group which opposes the policies of the national government, might not want the government to know their names and what they have been reading, so that the government cannot easily subvert their organization, arrest, or kill them. Other critics state that while a person might not have anything to hide right now, the government might later implement policies that they do wish to oppose, and that opposition might then be impossible due to mass surveillance enabling the government to identify and remove political threats. Further, other critics point to the fact that most people do have things to hide. For example, if a person is looking for a new job, they might not want their current employer to know this. Also if an employer wishes total privacy to watch over their own employee and secure their financial information it may become impossible, and they may not wish to hire those under surveillance."
Surveillance,https://en.wikipedia.org/wiki/Surveillance,"In December 2017, the Government of China took steps to oppose widespread surveillance by security-company cameras, webcams, and IP cameras after tens-of-thousands were made accessible for internet viewing by IT company Qihoo . [ 146 ]"
Surveillance,https://en.wikipedia.org/wiki/Surveillance,"Programs such as the Total Information Awareness program, and laws such as the Communications Assistance For Law Enforcement Act have led many groups to fear that society is moving towards a state of mass surveillance with severely limited personal, social, political freedoms, where dissenting individuals or groups will be strategically removed in COINTELPRO -like purges. [ 144 ] [ 145 ]"
Surveillance,https://en.wikipedia.org/wiki/Surveillance,"Kate Martin, of the Center For National Security Studies said of the use of military spy satellites being used to monitor the activities of U.S. citizens: ""They are laying the bricks one at a time for a police state."" [ 112 ]"
Surveillance,https://en.wikipedia.org/wiki/Surveillance,"Some point to the blurring of lines between public and private places, and the privatization of places traditionally seen as public (such as shopping malls and industrial parks) as illustrating the increasing legality of collecting personal information. [ 147 ] Traveling through many public places such as government offices is hardly optional for most people, yet consumers have little choice but to submit to companies' surveillance practices. [ 148 ] Surveillance techniques are not created equal; among the many biometric identification technologies, for instance, face recognition requires the least cooperation. Unlike automatic fingerprint reading, which requires an individual to press a finger against a machine, this technique is subtle and requires little to no consent. [ 148 ]"
Surveillance,https://en.wikipedia.org/wiki/Surveillance,"Some critics, such as Michel Foucault , believe that in addition to its obvious function of identifying and capturing individuals who are committing undesirable acts, surveillance also functions to create in everyone a feeling of always being watched, so that they become self-policing. This allows the State to control the populace without having to resort to physical force, which is expensive and otherwise problematic. [ 149 ]"
