source_title,source_url,text
Smart city,https://en.wikipedia.org/wiki/Smart_city,"A smart city is an urban model that leverages technology, human capital, and governance to improve sustainability, efficiency, and social inclusion, which are considered goals for cities of the future. [ 1 ] Smart cities use digital technology to collect data and operate services. [ 2 ] [ 3 ] Data is collected from citizens, devices, buildings, or cameras. Smart city applications are diverse and include, but are not limited to, traffic and transportation systems , [ 4 ] power plants, utilities , urban forestry , [ 5 ] water supply networks , waste disposal, criminal investigations, information systems , schools, libraries, hospitals, and other community services. [ 6 ] [ 7 ] The foundation of a smart city is built on the integration of people, technology, and processes, which connect and interact across sectors such as healthcare, transportation, education, infrastructure, etc. [ 8 ] Smart cities are characterized by the ways in which their local governments monitor, analyze, plan, and govern the city. In a smart city, data sharing extends to businesses, citizens, and other third parties who can derive benefit from using that data. [ 9 ] [ 10 ] The three largest sources of spending associated with smart cities as of 2022 were visual surveillance , public transit, and outdoor lighting. [ 11 ]"
Smart city,https://en.wikipedia.org/wiki/Smart_city,"Smart cities integrate Information and Communication Technologies (ICT), and devices connected to the Internet of things (IOT) network to optimize city services and connect to citizens. [ 12 ] [ 13 ] [ 14 ] ICT can enhance the quality, performance, and interactivity of urban services, reduce costs and resource consumption , and to increase contact between citizens and government. [ 15 ] Smart city applications manage urban flows and allow for real-time responses. [ 16 ] A smart city may be more prepared to respond to challenges than one with a conventional ""transactional"" relationship with its citizens. [ 17 ] [ 18 ] Yet, the term is open to many interpretations. [ 19 ] Many cities have already adopted some sort of smart city technology."
Smart city,https://en.wikipedia.org/wiki/Smart_city,"Smart city initiatives have been criticized as driven by corporations, [ 20 ] [ 21 ] poorly adapted to residents' needs, [ 22 ] [ 23 ] as largely unsuccessful, [ citation needed ] and as a move toward totalitarian surveillance . [ 24 ]"
Smart city,https://en.wikipedia.org/wiki/Smart_city,"Historically, cities functioned as centers of innovation, and the advent of the digital era presented opportunities and challenges to apply technology to create urban environments that are more efficient, sustainable , and livable. [ 25 ] [ 26 ] [ 27 ] [ 28 ] [ how? ] [ 29 ]"
Smart city,https://en.wikipedia.org/wiki/Smart_city,"The shift to smart cities necessitates a comprehensive restructuring of city management and operations, leading citizen participation, and methods of public service delivery. [ 28 ]"
Smart city,https://en.wikipedia.org/wiki/Smart_city,"Cities seek to upgrade their infrastructure and service delivery to promote social inclusion, technological adoption, and economic development. [ 29 ] [ 30 ] [ 31 ] [ 28 ]"
Smart city,https://en.wikipedia.org/wiki/Smart_city,"The transformation into a smart city involves modifications in planning, management, and operational processes. [ 32 ] This data can subsequently be analyzed to identify areas for improvement and optimize urban services."
Smart city,https://en.wikipedia.org/wiki/Smart_city,The concept of smart cities emerged from global cities' adoption [ 33 ] of information and communications technologies. [ 34 ] [ 35 ]
Smart city,https://en.wikipedia.org/wiki/Smart_city,"ICTs present challenges given financial limitations, technical obstacles, and privacy and security concerns. ICTs are also not uniformly accessible across communities, contributing to the digital divide . [ 29 ]"
Smart city,https://en.wikipedia.org/wiki/Smart_city,"No commonly accepted definition of ""smart city"" has emerged. [ 25 ] [ 36 ] : 71 Evaluating smart city initiatives is difficult without agreement on parameters. It also hampers the ability to compare projects and identify best practices. [ 37 ] [ 38 ] [ 32 ]"
Smart city,https://en.wikipedia.org/wiki/Smart_city,Deakin and Al Waer list four factors that contribute to the definition of a smart city: [ 39 ]
Smart city,https://en.wikipedia.org/wiki/Smart_city,"Deakin defines the smart city as one that uses ICT to meet the demands of the market (the citizens of the city), based on community involvement. [ 40 ] Studies of smart city projects can be used as an alternative to difficult-to-define broad definitions to clarify what smart cities are. [ 25 ] [ 41 ]"
Smart city,https://en.wikipedia.org/wiki/Smart_city,Notable disparities among smart city definitions include the relative focus on economic advantages versus environmental or social benefits and specific technology choices. [ 29 ]
Smart city,https://en.wikipedia.org/wiki/Smart_city,"An important motivation for smart cities is projected population growth. The UN forecasts the global population to reach 9.6 to 13.2 billion by 2100, with cities absorbing 80% of this growth. [ 46 ]"
Smart city,https://en.wikipedia.org/wiki/Smart_city,"An important goal of smart city initiatives is to use ICTs to address the tragedy of the commons problem. [ how? ] This phenomenon occurs when individuals acting in their own self-interest deplete a communal resource. For example, while each individual driver in a city saves time and flexibility by driving, the resultant excessive driving of the community causes traffic congestion and environmental issues . This situation is worsened when public transportation services get little attention due to the use of personal vehicles. [ 47 ]"
Smart city,https://en.wikipedia.org/wiki/Smart_city,"Philosophical predecessors of smart cities can be found in utopian works such as New Atlantis (1626). [ 48 ] Another was Ebenezer Howard 's 1898 concept of Garden Cities . [ 45 ] These were dense, size-limited cities founded in rural areas by private groups, combining the benefits of the city and the country. [ 49 ] Other conceptions include those of Edward Bellamy , Frank Lloyd Wright , and Le Corbusier . [ 45 ] [ 49 ] Critics of smart cities draw parallels between the weaknesses of these utopian visions and the weaknesses of smart cities today. [ 45 ]"
Smart city,https://en.wikipedia.org/wiki/Smart_city,"The concept of ""smart cities"" emerged from global cities' adoption of information and communications technologies for urban use, which can be used to improve efficiency, sustainability, and livability in urban environments. [ 33 ] [ 34 ] [ 35 ] Some of the earliest interventions in urban planning include the use of computational statistical analysis by the Community Analysis Bureau in Los Angeles in the late 1960s [ 50 ] and the establishment by Singapore of the National Computer Board in 1981. [ 51 ]"
Smart city,https://en.wikipedia.org/wiki/Smart_city,The smart city concept experienced a major surge around 2005. Tech companies sought to create information systems to enhance operational efficiency for cities. [ 52 ] [ 53 ] [ 54 ] [ 55 ]
Smart city,https://en.wikipedia.org/wiki/Smart_city,"IBM launched its Smarter Planet marketing initiative in 2008, [ 56 ] which included the IBM Smarter Cities Challenge. In 2010, Cisco Systems , with $25 million from the Clinton Foundation , established its Connected Urban Development program in partnership with San Francisco, Amsterdam, and Seoul. In 2011, the Smart City Expo World Congress in Barcelona attracted 6000 people from 50 countries. The European Commission in 2012 established the Smart Cities Marketplace, a centralized hub for urban initiatives in the European Union. [ 57 ] The 2015 Chancellor's Budget for the United Kingdom proposed to invest £140 million in smart cities and IoT. [ 58 ] Smart city competitions were launched in the 2010s by Bloomberg Philanthropies , the Rockefeller Foundation , and the United States Department of Transportation . [ 21 ] In 2016, AT&T launched an alliance with Cisco, Deloitte , Ericsson , General Electric , IBM, Intel , and Qualcomm , with municipal partners Atlanta , Georgia; Chicago, Illinois; and Dallas , Texas. [ 21 ]"
Smart city,https://en.wikipedia.org/wiki/Smart_city,"A 2024 research article identified six spatial manifestations of the smart cities, which are considered expressions of 21st century capitalism : [ 68 ]"
Smart city,https://en.wikipedia.org/wiki/Smart_city,It has been suggested that a smart city (or other community) uses information technologies to: [ citation needed ]
Smart city,https://en.wikipedia.org/wiki/Smart_city,"They evolve towards a strong integration of all dimensions of human intelligence , collective intelligence , and also artificial intelligence within the city. [ 73 ] : 112–113 [ 74 ] According to Mitchell, the intelligence of cities ""resides in the increasingly effective combination of digital telecommunication networks (the nerves), ubiquitously embedded intelligence (the brain), sensors and tags (the sensory organs), and software (the knowledge and cognitive competence)"". [ 75 ]"
Smart city,https://en.wikipedia.org/wiki/Smart_city,"The physical components of IT systems are crucial to early-stage smart city development. Wired infrastructure is required to support the IOT and wireless technologies central to more interconnected living. [ 76 ] A wired city environment provides general access to continually updated digital and physical infrastructure. The latest in telecommunications, robotics , IOT, and various connected technologies can then be deployed to support human capital and productivity. [ 77 ] [ 78 ]"
Smart city,https://en.wikipedia.org/wiki/Smart_city,Intelligence in smart cities has been demonstrated in three ways: [ citation needed ]
Smart city,https://en.wikipedia.org/wiki/Smart_city,Examples of instrumentation intelligence are those implemented in Amsterdam . [ 81 ] This is realized through: [ 16 ]
Smart city,https://en.wikipedia.org/wiki/Smart_city,"Smart cities use data and technology to create efficiencies, improve sustainability, create economic development, and enhance quality of life factors for people living and working in the city. [ citation needed ] A variety of different datasets may need to be integrated to create a smart energy infrastructure. [ 82 ] Employment of smart technologies enables the more efficient application of integrated energy technologies in the city allowing the development of more self-sustaining areas or even Positive Energy Districts that produce more energy than they consume. [ 83 ] [ how? ]"
Smart city,https://en.wikipedia.org/wiki/Smart_city,"A smart city is powered by ""smart connections"" for various items such as street lighting, smart buildings , distributed energy resources , data analytics , and smart transportation. Amongst these things, energy is paramount; this is why utility companies play a key role in smart cities. Electric companies, working partnership with city officials, technology companies and a number of other institutions, are among the major players that helped accelerate the growth of America's smart cities. [ 84 ]"
Smart city,https://en.wikipedia.org/wiki/Smart_city,"According to David K. Owens, the former executive vice president of the Edison Electric Institute , two key elements that a smart city must have are an integrated communications platform and a ""dynamic resilient grid."" [ 85 ]"
Smart city,https://en.wikipedia.org/wiki/Smart_city,Smart grids are an important technology in smart cities. The improved flexibility of the smart grid permits greater penetration of highly variable renewable energy sources such as solar power and wind power. [ citation needed ]
Smart city,https://en.wikipedia.org/wiki/Smart_city,Energy Data Management Systems can help to save cities energy by recording data and using it to increase efficiency. [ 86 ]
Smart city,https://en.wikipedia.org/wiki/Smart_city,"For a smart city to function, it is necessary for it to manage an enormous amount of data collected through the embedded devices and systems in its environment. [ 87 ] This is also important for the cities growth and security. [ 88 ] Smart cities use a variety of data collection, processing, and disseminating technologies, in conjunction with data security and privacy measures, in attempting to encourage innovation and improve citizens' quality of life. [ 87 ] This can relate to topics including utilities, health, transportation, entertainment, and government services. [ 87 ]"
Smart city,https://en.wikipedia.org/wiki/Smart_city,Online collaborative sensor data management platforms are on-line database services that allow sensor owners to register and connect their devices to feed data into an on-line database for storage and allow developers to connect to the database and build their own applications based on that data. [ 89 ] [ 90 ]
Smart city,https://en.wikipedia.org/wiki/Smart_city,Electronic cards (known as smart cards ) are another common component in smart city contexts. These cards possess a unique encrypted identifier that allows the owner to log into a range of government-provided services (or e-services ) without setting up multiple accounts. The single identifier allows governments to aggregate data about citizens and their preferences to improve the provision of services and to determine common interests of groups. This technology has been implemented in Southampton. [ 39 ]
Smart city,https://en.wikipedia.org/wiki/Smart_city,"Cognitive technologies, such as artificial intelligence and machine learning , can be trained on the data generated by connected city devices to identify patterns. The efficacy and impact of particular policy decisions can be quantified by cognitive systems studying the continuous interactions of humans with their urban surroundings. [ 91 ]"
Smart city,https://en.wikipedia.org/wiki/Smart_city,Intelligent transportation systems and CCTV systems are also being developed. [ 93 ]
Smart city,https://en.wikipedia.org/wiki/Smart_city,"Retractable bollards can restrict access inside city centers (i.e. to delivery trucks resupplying outlet stores). Opening and closing of such barriers is traditionally done manually, through an electronic pass [ 94 ] but can even be done by means of automatic number-plate recognition cameras connected to the bollard system. [ 95 ]"
Smart city,https://en.wikipedia.org/wiki/Smart_city,"According to McKinsey, smart city initiatives can have measurable positive impacts on the quality of life of its citizens and visitors. [ 96 ] The human framework of a smart city – its economy, knowledge networks, and human support systems – is an important indicator of its success. [ 97 ]"
Smart city,https://en.wikipedia.org/wiki/Smart_city,"For example, arts and culture initiatives are common focus areas in smart city planning. [ 98 ] [ 99 ] Innovation is associated with intellectual curiosity and creativeness, and various projects have demonstrated that knowledge workers participate in a diverse mix of cultural and artistic activities. [ 100 ] [ 101 ]"
Smart city,https://en.wikipedia.org/wiki/Smart_city,"Since mobility is a key area of smart city development, building a capable workforce through education initiatives is necessary. [ 97 ] [ clarification needed ] A city's learning capacity includes its education system, including available workforce training and support, and its cultural development and exchange. [ 102 ]"
Smart city,https://en.wikipedia.org/wiki/Smart_city,"Numerous smart city programs also focus on soft infrastructure development, like increasing access to voluntary organizations and designated safe zones. [ 103 ] This focus on social and relational capital means diversity, inclusion, and ubiquitous access to public services is worked into city planning. [ 78 ]"
Smart city,https://en.wikipedia.org/wiki/Smart_city,The development of a knowledge economy is also central to smart city projects. [ 104 ] Smart cities seeking to be hubs of economic activity in emerging tech and service sectors stress the value of innovation in city development. [ 78 ]
Smart city,https://en.wikipedia.org/wiki/Smart_city,"Additional supporting technology and trends include remote work , [ 119 ] [ 120 ] [ 121 ] telehealth , [ 122 ] [ 123 ] the blockchain , [ 124 ] [ 125 ] and online banking technology, [ 126 ]"
Smart city,https://en.wikipedia.org/wiki/Smart_city,"A ""ubiquitous city""(U-city) is one concept of a smart city that provides access to public services through any connected device, bringing easy accessibility to every infrastructure. [ 127 ]"
Smart city,https://en.wikipedia.org/wiki/Smart_city,"In 2023, the Salisbury smart cities controversy arose after a proposal for smart city technology in the South Australian local government area of City of Salisbury was met with community backlash leading to a range of conspiracy theories. [ 141 ] [ 142 ] [ 143 ]"
Smart city,https://en.wikipedia.org/wiki/Smart_city,The African Union Commission pledged to use ICTs to advance sustainable urban development. [ 144 ]
Smart city,https://en.wikipedia.org/wiki/Smart_city,"The ""smart communities"" movement took shape as a strategy to involve more users in IT. [ 102 ] Primary issues included traffic congestion, school overcrowding and air pollution. [ 102 ]"
Smart city,https://en.wikipedia.org/wiki/Smart_city,China's smart cities movement began with a pilot program launched in 2012 through its Ministry of Housing and Urban-Rural Development . [ 36 ] : 58–59 China's National New-Type Urbanization Plan for 2014–2020 included smart cities. [ 36 ] : 59–60 It identified six important aspects for developing smart cities: [ 36 ] : 60
Smart city,https://en.wikipedia.org/wiki/Smart_city,"As of 2016, approximately 500 smart city projects had launched. [ 36 ] : 59 In 2021, China took first in all categories of the International AI City Challenge – ""by some estimates, China has half of the world's smart cities"". [ 145 ]"
Smart city,https://en.wikipedia.org/wiki/Smart_city,"Alibaba created City Brain . [ 146 ] [ 147 ] Its first overseas implementation began in 2018 in Kuala Lumpur , Malaysia. [ 148 ] : 82"
Smart city,https://en.wikipedia.org/wiki/Smart_city,"Baidu developed Apollo , a self-driving technology. [ 149 ] Tencent launched medical technology, [ 149 ] such as WeChat Intelligent Healthcare, Tencent Doctorwork, and AI Medical Innovation System (AIMIS) . [ 150 ]"
Smart city,https://en.wikipedia.org/wiki/Smart_city,"As of 2021, Huawei and ZTE had more than 350 smart city projects in more than 60 countries. [ 151 ] : 11"
Smart city,https://en.wikipedia.org/wiki/Smart_city,"As of 2024, ""Safe City"" digital products were marketed abroad by Chinese companies including Dahua Technology , Huawei, ZTE, and Hikvision . [ 148 ] : 80 Huawei's Safe City Compact Solution focuses on improving safety. [ 152 ] [ 153 ] [ 154 ] In 2018, Serbia announced a Safe City project for Belgrade in conjunction with Huawei, using one thousand cameras with advanced facial recognition and license plate recognition capabilities. [ 148 ] : 82"
Smart city,https://en.wikipedia.org/wiki/Smart_city,"EU members began working on smart city developments and ICT initiatives in the mid-2010s. The Digital Agenda for Europe framework emphasizes harnessing ICTs. The 2014–15 budget of the Horizon 2020 Research and Innovation program, included approximately 200 million Euros to expedite smart cities. [ 155 ] [ 156 ] : 337–355 [ 157 ]"
Smart city,https://en.wikipedia.org/wiki/Smart_city,The Smart Cities Mission is a retrofitting and urban renewal program spearheaded by the Ministry of Urban Development. [ 158 ]
Smart city,https://en.wikipedia.org/wiki/Smart_city,"ASEAN Smart Cities Network (ASCN) is a collaborative platform to advance smart city efforts across ASEAN by catalysing bankable projects, and securing funding and support from ASEAN's external partners. [ 159 ]"
Smart city,https://en.wikipedia.org/wiki/Smart_city,"The New Urban Agenda emphasized the importance of smart city development, establishing a fundamental commitment for the UN's 193 member states. [ 160 ] [ 161 ] [ 162 ]"
Smart city,https://en.wikipedia.org/wiki/Smart_city,"The United States allocated more than $160 million toward smart city initiatives. Challenges include traffic congestion , economic growth, crime, climate change , and public services. [ citation needed ]"
Smart city,https://en.wikipedia.org/wiki/Smart_city,"Taiwan has actively promoted smart city development through government-led initiatives such as the Smart City Taiwan program, launched in 2018 by the Ministry of Economic Affairs. The program partners with local governments and private companies to deploy pilot projects in areas including healthcare, transportation, public safety, environmental monitoring, and education. [ 163 ]"
Smart city,https://en.wikipedia.org/wiki/Smart_city,"Taipei , [ 164 ] Taoyuan , [ 165 ] and Tainan [ 166 ] have emerged as leading smart cities, implementing solutions such as AI-assisted traffic management, smart street lighting, and real-time air quality sensors. The government also supports a Public-Private-People Partnership (P-P-P-P) model to involve citizens in the co-creation of services. [ 167 ]"
Smart city,https://en.wikipedia.org/wiki/Smart_city,"Taiwan's approach emphasizes the integration of 5G, IOT , and artificial intelligence (AI) to improve urban livability and sustainability. The annual Smart City Summit & Expo in Taipei has become a major platform for showcasing Taiwan's innovations and fostering international collaboration. [ 168 ] [ 169 ]"
Smart city,https://en.wikipedia.org/wiki/Smart_city,"The most common characteristics of a ""smart city"" are networked infrastructure; emphasis on business-led urban development; social inclusion of various resident groups; and an emphasis on the environment. [ 25 ] [ 29 ]"
Smart city,https://en.wikipedia.org/wiki/Smart_city,"Smart city initiatives require collaboration and involvement from government agencies, businesses, community organizations, academia, and citizens. Collaborating with businesses and academia brings technical know-how and research capabilities. [ 170 ] [ 171 ] [ 172 ]"
Smart city,https://en.wikipedia.org/wiki/Smart_city,Collaborations with community organizations can improve equity and inclusivity. [ 29 ]
Surveillance,https://en.wikipedia.org/wiki/Surveillance,"Surveillance is the systematic observation and monitoring of a person, population , or location, with the purpose of information-gathering, influencing, managing , or directing. [ 1 ] [ 2 ]"
Surveillance,https://en.wikipedia.org/wiki/Surveillance,"It is widely used by governments for a variety of reasons, such as law enforcement , national security , and information awareness. It can also be used as a tactic by persons who are not working on behalf of a government, such as by criminal organizations to plan and commit crimes, and by businesses to gather intelligence on criminals, their competitors, suppliers or customers. Religious organizations charged with detecting heresy and heterodoxy may also carry out surveillance. [ 3 ] Various kinds of auditors carry out a form of surveillance. [ 4 ]"
Surveillance,https://en.wikipedia.org/wiki/Surveillance,"Surveillance is done in a variety of methods, such as human interaction , postal interception , closed-circuit television (CCTV) cameras, wiretapping , and data mining ."
Surveillance,https://en.wikipedia.org/wiki/Surveillance,"Surveillance can unjustifiably violate people's privacy and is often criticized by civil liberties activists. [ 5 ] Democracies may have laws that seek to restrict governmental and private use of surveillance, whereas authoritarian governments seldom have any domestic restrictions. Increasingly, government and intelligence agencies have conducted surveillance by obtaining consumer data through the purchase of online information. [ 6 ] Improvements in the technology available to governments have led to mass surveillance and global surveillance ."
Surveillance,https://en.wikipedia.org/wiki/Surveillance,"Espionage is by definition covert and typically illegal according to the rules of the observed party, [ 7 ] whereas state authorities typically regulate surveillance and consider many uses legal or legitimate."
Surveillance,https://en.wikipedia.org/wiki/Surveillance,"The vast majority of computer surveillance involves the monitoring of data and traffic on the Internet . [ 8 ] In the United States for example, under the Communications Assistance For Law Enforcement Act , all phone calls and broadband Internet traffic (emails, web traffic, instant messaging, etc.) are required to be available for unimpeded real-time monitoring by federal law enforcement agencies. [ 9 ] [ 10 ] [ 11 ]"
